Category_ID,Category_Name,Category_Description,Category_Image
1,Drama,"Glaucoma secondary to other eye disorders, bilateral",http://dummyimage.com/231x100.png/5fa2dd/ffffff
2,Comedy|Crime,"Other infective (teno)synovitis, right hip",http://dummyimage.com/171x100.png/5fa2dd/ffffff
3,Comedy|Crime|Drama|Western,"Partial loss of teeth, unspecified cause, unspecified class",http://dummyimage.com/156x100.png/dddddd/000000
4,Action|Comedy|Drama,Wegener's granulomatosis without renal involvement,http://dummyimage.com/208x100.png/dddddd/000000
5,Action|Adventure,"Fx unsp prt of nk of l femr, 7thQ",http://dummyimage.com/222x100.png/ff4444/ffffff
6,Animation|Children|Comedy|Musical,"Nondisplaced transcondylar fracture of right humerus, init",http://dummyimage.com/200x100.png/dddddd/000000
7,Action|Adventure|Animation|Crime|Fantasy,Fall due to bumping against object,http://dummyimage.com/227x100.png/dddddd/000000
8,Film-Noir|Thriller,"Burn unsp degree of unsp site left lower limb, except ank/ft",http://dummyimage.com/250x100.png/ff4444/ffffff
9,Comedy|Drama|Romance,"Disp fx of r tibial tuberosity, 7thM",http://dummyimage.com/100x100.png/dddddd/000000
10,Animation|Children|Drama|Musical|Romance,"Unspecified sprain of right index finger, sequela",http://dummyimage.com/235x100.png/5fa2dd/ffffff
11,Animation|Children|Comedy|Romance,"Nondisp fx of neck of third MC bone, l hand, init for opn fx",http://dummyimage.com/208x100.png/cc0000/ffffff
12,Comedy|Drama,"Pnctr w/o fb of l little finger w damage to nail, sequela",http://dummyimage.com/227x100.png/cc0000/ffffff
13,Comedy,"Myositis ossificans progressiva, left thigh",http://dummyimage.com/113x100.png/5fa2dd/ffffff
14,Animation|Children|Drama|Fantasy|IMAX,"Laceration w/o fb of left cheek and TMJ area, sequela",http://dummyimage.com/129x100.png/ff4444/ffffff
15,Drama,Abrasion of right hand,http://dummyimage.com/199x100.png/dddddd/000000
16,Drama,"Poisoning by tricyclic antidepressants, self-harm, sequela",http://dummyimage.com/153x100.png/ff4444/ffffff
17,Action|Horror|Sci-Fi|Thriller,Open wound of nose,http://dummyimage.com/240x100.png/ff4444/ffffff
18,Comedy|Fantasy,"Unsp inj unsp musc/fasc/tend at wrs/hnd lv, unsp hand, init",http://dummyimage.com/129x100.png/cc0000/ffffff
19,Drama,"Burn of first degree of unspecified thigh, sequela",http://dummyimage.com/203x100.png/cc0000/ffffff
20,Comedy|Romance,Major laceration of pancreas,http://dummyimage.com/126x100.png/5fa2dd/ffffff
21,Documentary,"Assault by other larger firearm discharge, subs encntr",http://dummyimage.com/198x100.png/dddddd/000000
22,Drama,"Sltr-haris Type III physl fx low end l tibia, 7thD",http://dummyimage.com/138x100.png/5fa2dd/ffffff
23,Sci-Fi,"Poisoning by local anesthetics, intentional self-harm, subs",http://dummyimage.com/184x100.png/5fa2dd/ffffff
24,Comedy|Drama|Mystery|Romance,"Inj l int crtd,intcr w LOC >24 hr w/o ret consc w surv, sqla",http://dummyimage.com/209x100.png/cc0000/ffffff
25,Comedy|Horror,"Pathological fracture, unspecified hand, sequela",http://dummyimage.com/212x100.png/dddddd/000000
26,Thriller,"Pnctr w/o fb of right great toe w damage to nail, sequela",http://dummyimage.com/125x100.png/cc0000/ffffff
27,Comedy,"Nondisp fx of base of nk of unsp femr, 7thR",http://dummyimage.com/203x100.png/5fa2dd/ffffff
28,Drama|Sci-Fi,Other disturbances of skin sensation,http://dummyimage.com/126x100.png/dddddd/000000
29,Comedy|Drama|Horror,Other chronic nonsuppurative otitis media,http://dummyimage.com/177x100.png/dddddd/000000
30,(no genres listed),"Poisoning by other antidepressants, assault, init encntr",http://dummyimage.com/220x100.png/cc0000/ffffff
31,Sci-Fi|Thriller,"Poisoning by alpha-adrenocpt antagonists, undetermined, init",http://dummyimage.com/152x100.png/dddddd/000000
32,Drama,"Other dislocation of right ulnohumeral joint, init encntr",http://dummyimage.com/244x100.png/cc0000/ffffff
33,Drama,"Posterior dislocation of left sternoclavicular joint, init",http://dummyimage.com/225x100.png/ff4444/ffffff
34,Drama|Thriller,"Assault by smoke, fire and flames, sequela",http://dummyimage.com/226x100.png/cc0000/ffffff
35,Drama,"Nondisp longitud fx l patella, 7thN",http://dummyimage.com/101x100.png/ff4444/ffffff
36,Drama|Sci-Fi,"Other superficial bite of ankle, unsp ankle, init encntr",http://dummyimage.com/222x100.png/dddddd/000000
37,Comedy|Drama,"Spontaneous rupture of flexor tendons, unspecified forearm",http://dummyimage.com/107x100.png/5fa2dd/ffffff
38,Crime|Drama,Adverse effect of unsp drug/meds/biol subst,http://dummyimage.com/217x100.png/dddddd/000000
39,Action|Drama,"Contact with workbench tool, initial encounter",http://dummyimage.com/198x100.png/cc0000/ffffff
40,Action|Crime|Drama,"Other secondary osteonecrosis, left fibula",http://dummyimage.com/240x100.png/ff4444/ffffff
41,Comedy|Drama|Romance,"Disp fx of unsp ulna styloid pro, 7thF",http://dummyimage.com/119x100.png/ff4444/ffffff
42,Drama,Oth parlyt synd fol ntrm subarach hemor aff left dom side,http://dummyimage.com/229x100.png/5fa2dd/ffffff
43,Comedy,"Toxic effect of insecticides, accidental, sequela",http://dummyimage.com/129x100.png/5fa2dd/ffffff
44,Drama,"Oth nondisp fx of lower end of left humerus, init for opn fx",http://dummyimage.com/215x100.png/5fa2dd/ffffff
45,Drama|Romance,"Partial traumatic amputation of unsp breast, init encntr",http://dummyimage.com/159x100.png/ff4444/ffffff
46,Comedy|Drama,"Subluxation of proximal interphalangeal joint of thmb, subs",http://dummyimage.com/169x100.png/cc0000/ffffff
47,Drama,"Superficial foreign body, right knee, initial encounter",http://dummyimage.com/245x100.png/ff4444/ffffff
48,Horror|Thriller,Music hall as the place of occurrence of the external cause,http://dummyimage.com/180x100.png/ff4444/ffffff
49,Comedy|Drama|Romance,"Toxic effect of unsp noxious sub eaten as food, slf-hrm",http://dummyimage.com/248x100.png/cc0000/ffffff
50,Comedy|Crime|Drama,"Osteophyte, left knee",http://dummyimage.com/177x100.png/5fa2dd/ffffff
51,Action|Comedy|Crime|Drama|Thriller,"Infective myositis, right ankle",http://dummyimage.com/106x100.png/5fa2dd/ffffff
52,Comedy,"Infections of urethra in pregnancy, third trimester",http://dummyimage.com/202x100.png/5fa2dd/ffffff
53,Children|Drama,"Unsp fracture of right wrs/hnd, subs for fx w routn heal",http://dummyimage.com/186x100.png/cc0000/ffffff
54,Drama,"Explosion on board other powered watercraft, sequela",http://dummyimage.com/119x100.png/dddddd/000000
55,Drama|Romance,Crushing injury of unspecified elbow,http://dummyimage.com/250x100.png/ff4444/ffffff
56,Comedy|Romance,"Milt op involving fragments from munitions, civilian, subs",http://dummyimage.com/172x100.png/5fa2dd/ffffff
57,Drama,"Contact with knife, sequela",http://dummyimage.com/179x100.png/5fa2dd/ffffff
58,Action|Comedy|Crime,"Unspecified dislocation of right wrist and hand, init encntr",http://dummyimage.com/187x100.png/5fa2dd/ffffff
59,Comedy,Major laceration of pulmonary blood vessels,http://dummyimage.com/206x100.png/cc0000/ffffff
60,Children|Comedy|Fantasy|Romance,"Stable burst fracture of T11-T12 vertebra, init for clos fx",http://dummyimage.com/155x100.png/dddddd/000000
61,Drama|War,"Myositis ossificans progressiva, other site",http://dummyimage.com/189x100.png/5fa2dd/ffffff
62,Drama,Corrosion of third degree of right upper arm,http://dummyimage.com/190x100.png/ff4444/ffffff
63,Drama,Unspecified foreign body in pharynx,http://dummyimage.com/162x100.png/cc0000/ffffff
64,Documentary,"Unequal limb length (acquired), left fibula",http://dummyimage.com/111x100.png/5fa2dd/ffffff
65,Comedy|Drama,"Unsp injury of fallopian tube, unilateral, init encntr",http://dummyimage.com/198x100.png/cc0000/ffffff
66,Animation|Sci-Fi,"Traumatic subcutaneous emphysema, initial encounter",http://dummyimage.com/207x100.png/cc0000/ffffff
67,Drama|Horror,"Skateboarder colliding with stationary object, init encntr",http://dummyimage.com/176x100.png/5fa2dd/ffffff
68,Crime|Drama,Ambulatory surgery center as place,http://dummyimage.com/112x100.png/cc0000/ffffff
69,Documentary,"Nondisp intartic fracture of r calcaneus, init for opn fx",http://dummyimage.com/203x100.png/dddddd/000000
70,Drama,"Abnormality of plasma protein, unspecified",http://dummyimage.com/148x100.png/5fa2dd/ffffff
71,Comedy,"Poisoning by peripheral vasodilators, assault, subs encntr",http://dummyimage.com/192x100.png/5fa2dd/ffffff
72,Comedy|Drama,"Poisoning by histamine H2-receptor blockers, undet, sequela",http://dummyimage.com/240x100.png/cc0000/ffffff
73,Mystery,Sucked into jet engine,http://dummyimage.com/171x100.png/ff4444/ffffff
74,Drama,"Displ oth extrartic fx unsp calcaneus, 7thG",http://dummyimage.com/174x100.png/cc0000/ffffff
75,Comedy|Drama,"Toxic effect of homologues of benzene, assault, init encntr",http://dummyimage.com/235x100.png/cc0000/ffffff
76,Horror|Thriller,Acquired stenosis of bilateral nasolacrimal duct,http://dummyimage.com/123x100.png/ff4444/ffffff
77,Drama,"Unsp physeal fx lower end of ulna, left arm, sequela",http://dummyimage.com/204x100.png/cc0000/ffffff
78,Documentary,"Disp fx of olecran pro w/o intartic extn unsp ulna, 7thM",http://dummyimage.com/161x100.png/5fa2dd/ffffff
79,Drama|Mystery|Sci-Fi|Thriller,"Other superficial bite of unsp parts of thorax, subs encntr",http://dummyimage.com/200x100.png/ff4444/ffffff
80,Documentary|Drama,"Toxic effect of venom of other snake, undetermined, sequela",http://dummyimage.com/208x100.png/dddddd/000000
81,Crime|Film-Noir|Mystery,"Burn of first deg mult sites of right wrist and hand, subs",http://dummyimage.com/240x100.png/ff4444/ffffff
82,Crime|Drama|Thriller,Nonspec elev of levels of transamns & lactic acid dehydrgnse,http://dummyimage.com/210x100.png/5fa2dd/ffffff
83,Crime|Drama|Mystery|Romance|Thriller,Underdosing of phenothiazine antipsychotics and neuroleptics,http://dummyimage.com/122x100.png/dddddd/000000
84,(no genres listed),"Person inj in clsn betw car and 2/3-whl mv, nontraf, subs",http://dummyimage.com/114x100.png/cc0000/ffffff
85,Comedy,"Acquired clawhand, unspecified hand",http://dummyimage.com/159x100.png/cc0000/ffffff
86,Action,"Torus fx lower end of unsp humerus, subs for fx w malunion",http://dummyimage.com/120x100.png/cc0000/ffffff
87,Documentary,Personal history of malignant neoplasm of tongue,http://dummyimage.com/211x100.png/ff4444/ffffff
88,Drama,"Preterm labor second tri w preterm del second tri, fetus 2",http://dummyimage.com/195x100.png/cc0000/ffffff
89,Documentary,"Car passenger injured in collision w hv veh nontraf, sequela",http://dummyimage.com/209x100.png/5fa2dd/ffffff
90,Action|Sci-Fi,Hemorrhagic detachment of retinal pigment epithelium,http://dummyimage.com/180x100.png/ff4444/ffffff
91,Horror|Sci-Fi|Thriller,"Complete traum amp at level betw knee and ankle, l low leg",http://dummyimage.com/176x100.png/5fa2dd/ffffff
92,Drama,Smith's fracture of unspecified radius,http://dummyimage.com/125x100.png/ff4444/ffffff
93,Drama|Mystery|Thriller,"Macular keratitis, right eye",http://dummyimage.com/244x100.png/ff4444/ffffff
94,Documentary|Horror|War,"Corros unsp deg mult fingers (nail), not including thumb",http://dummyimage.com/143x100.png/dddddd/000000
95,Action|Adventure|Drama,"Glasgow coma scale score 3-8, in the field",http://dummyimage.com/226x100.png/cc0000/ffffff
96,Comedy|Drama|Musical,"Puncture wound with foreign body of unsp breast, subs encntr",http://dummyimage.com/163x100.png/ff4444/ffffff
97,Comedy|Drama|Romance,"Displ seg fx shaft of rad, l arm, 7thG",http://dummyimage.com/233x100.png/cc0000/ffffff
98,Drama|Mystery|Thriller,"Abrasion of right ear, subsequent encounter",http://dummyimage.com/187x100.png/ff4444/ffffff
99,Drama,"Disp fx of base of fifth MC bone. left hand, init for opn fx",http://dummyimage.com/117x100.png/cc0000/ffffff
100,Comedy,"Antivaricose drugs, including sclerosing agents",http://dummyimage.com/119x100.png/cc0000/ffffff
101,Drama,Personal history of other benign neoplasm,http://dummyimage.com/233x100.png/5fa2dd/ffffff
102,Action|Crime|Drama,"Person outside bus injured pick-up truck, pk-up/van in traf",http://dummyimage.com/194x100.png/dddddd/000000
103,Animation,"Unsp fracture of unsp forearm, subs for clos fx w nonunion",http://dummyimage.com/242x100.png/5fa2dd/ffffff
104,Comedy|Crime|Fantasy,"Other chondrocalcinosis, right ankle and foot",http://dummyimage.com/245x100.png/cc0000/ffffff
105,Crime|Drama|Horror,"Disp fx of shaft of unsp clavicle, init for opn fx",http://dummyimage.com/248x100.png/5fa2dd/ffffff
106,Adventure|Animation|Children|Fantasy|Mystery,Problems related to lifestyle,http://dummyimage.com/157x100.png/5fa2dd/ffffff
107,Drama|Romance,"Unsp injury of less saphenous at lower leg level, unsp leg",http://dummyimage.com/203x100.png/dddddd/000000
108,Comedy|Horror,"Unsp physl fx upper end l fibula, subs for fx w delay heal",http://dummyimage.com/219x100.png/5fa2dd/ffffff
109,Drama,"Nondisp oblique fx shaft of l femr, 7thG",http://dummyimage.com/122x100.png/5fa2dd/ffffff
110,Comedy,"Contusion of right lesser toe(s) w/o damage to nail, sequela",http://dummyimage.com/124x100.png/5fa2dd/ffffff
111,Comedy,Traumatic rupture of unspecified ligament of wrist,http://dummyimage.com/190x100.png/dddddd/000000
112,Crime|Drama|Mystery|Thriller,Ptosis of breast,http://dummyimage.com/220x100.png/dddddd/000000
113,Romance,"Poisoning by selective serotonin reuptake inhibitors, acc",http://dummyimage.com/162x100.png/dddddd/000000
114,Drama|Romance,"Abrasion, left great toe, sequela",http://dummyimage.com/203x100.png/5fa2dd/ffffff
115,Comedy|Drama|Romance,"Contact with contaminated hypodermic needle, init encntr",http://dummyimage.com/130x100.png/cc0000/ffffff
116,Drama|Horror|Mystery,"Nondisp fx of triquetrum bone, r wrs, 7thG",http://dummyimage.com/157x100.png/cc0000/ffffff
117,Comedy|Drama,Crohn's disease of small intestine with complications,http://dummyimage.com/146x100.png/cc0000/ffffff
118,Drama|War,Dislocation of MTP joint of unsp lesser toe(s),http://dummyimage.com/198x100.png/5fa2dd/ffffff
119,Crime|Drama|Mystery,Other specified urinary incontinence,http://dummyimage.com/213x100.png/dddddd/000000
120,Adventure|Fantasy|Sci-Fi,"Underdosing of oral contraceptives, initial encounter",http://dummyimage.com/143x100.png/dddddd/000000
121,Crime|Drama|Horror|Thriller,"Athscl autol vein bypass of extrm w intrmt claud, oth extrm",http://dummyimage.com/115x100.png/5fa2dd/ffffff
122,Action|Adventure|War,"Unspecified open wound, left foot, initial encounter",http://dummyimage.com/225x100.png/dddddd/000000
123,Drama|Romance,"Passenger on bus injured in clsn w unsp mv nontraf, init",http://dummyimage.com/120x100.png/cc0000/ffffff
124,Drama|Romance,"Complete traumatic amputation of left breast, subs encntr",http://dummyimage.com/240x100.png/cc0000/ffffff
125,Documentary|War,Other superficial bite of unspecified shoulder,http://dummyimage.com/123x100.png/cc0000/ffffff
126,Horror,"Fatigue fx vertebra, thor region, subs for fx w delay heal",http://dummyimage.com/228x100.png/ff4444/ffffff
127,Drama,"Unspecified subluxation of right patella, initial encounter",http://dummyimage.com/198x100.png/5fa2dd/ffffff
128,Drama,"Presence of artificial knee joint, bilateral",http://dummyimage.com/100x100.png/5fa2dd/ffffff
129,(no genres listed),Aneurysm of heart,http://dummyimage.com/224x100.png/dddddd/000000
130,Crime|Documentary,"Stress fracture, unsp finger(s), subs for fx w malunion",http://dummyimage.com/186x100.png/ff4444/ffffff
131,Fantasy|Horror|Thriller,Autoinflammatory syndromes,http://dummyimage.com/215x100.png/cc0000/ffffff
132,Drama|Romance,"Other mechanical complication of umbrella device, sequela",http://dummyimage.com/241x100.png/dddddd/000000
133,Comedy|Drama|Romance,Presence of other specified functional implants,http://dummyimage.com/128x100.png/ff4444/ffffff
134,Fantasy,"Unsp inj less saphenous at lower leg level, unsp leg, init",http://dummyimage.com/232x100.png/dddddd/000000
135,Animation|Children|Comedy,"Accident to, on or involving ice yacht, sequela",http://dummyimage.com/242x100.png/cc0000/ffffff
136,Drama|Horror|Mystery,Car passenger injured in collision w pedal cycle nontraf,http://dummyimage.com/187x100.png/ff4444/ffffff
137,Drama|Romance,"Unspecified injury of thoracic trachea, initial encounter",http://dummyimage.com/223x100.png/5fa2dd/ffffff
138,Adventure|Animation|Children|Comedy|Crime|Fantasy|Mystery,Influenza due to unidentified influenza virus w oth manifest,http://dummyimage.com/181x100.png/cc0000/ffffff
139,Western,"Onchocerciasis with eye involvement, unspecified",http://dummyimage.com/120x100.png/dddddd/000000
140,Comedy|Crime|Drama,"Major laceration of right external jugular vein, subs encntr",http://dummyimage.com/101x100.png/cc0000/ffffff
141,Action|Crime|Drama|Horror,"Other sprain of unspecified hip, subsequent encounter",http://dummyimage.com/102x100.png/cc0000/ffffff
142,Drama,"Hodgkin lymphoma, unspecified, lymph nodes of multiple sites",http://dummyimage.com/113x100.png/5fa2dd/ffffff
143,Documentary,"Burn 3rd deg mu sites of left shldr/up lmb, ex wrs/hnd, init",http://dummyimage.com/240x100.png/cc0000/ffffff
144,Musical,"Open bite of abd wall, l upr q w penet perit cav, sequela",http://dummyimage.com/113x100.png/ff4444/ffffff
145,Action|Comedy|Crime|Thriller,4-part fracture of surgical neck of left humerus,http://dummyimage.com/138x100.png/cc0000/ffffff
146,Action|Drama|Fantasy,"Inj intercostal blood vessels, right side, init encntr",http://dummyimage.com/126x100.png/5fa2dd/ffffff
147,Documentary,"Hydroxyapatite deposition disease, unspecified elbow",http://dummyimage.com/216x100.png/cc0000/ffffff
148,Crime|Drama,Other foreign object in bronchus causing other injury,http://dummyimage.com/177x100.png/dddddd/000000
149,Musical,"Mediastnl large B-cell lymph, nodes of head, face, and neck",http://dummyimage.com/207x100.png/dddddd/000000
150,Comedy|Drama|Romance,"Stress fracture, left foot, sequela",http://dummyimage.com/214x100.png/cc0000/ffffff
151,Crime|Drama|Thriller,"Twin pregnancy, monochorionic/diamniotic, first trimester",http://dummyimage.com/113x100.png/5fa2dd/ffffff
152,Mystery|Sci-Fi|Thriller|IMAX,Other deformities of toe(s) (acquired),http://dummyimage.com/128x100.png/cc0000/ffffff
153,Documentary,Athscl type of bypass graft(s) of extremity w ulceration,http://dummyimage.com/189x100.png/cc0000/ffffff
154,Drama,"Otalgia, left ear",http://dummyimage.com/127x100.png/cc0000/ffffff
155,Comedy,Toxic liver disease with chronic active hepatitis,http://dummyimage.com/189x100.png/5fa2dd/ffffff
156,Drama,"Displ lateral mass fx first cervcal vert, init for opn fx",http://dummyimage.com/209x100.png/cc0000/ffffff
157,Comedy|Drama,"Struck by golf ball, sequela",http://dummyimage.com/188x100.png/ff4444/ffffff
158,Drama,"Crushed by alligator, initial encounter",http://dummyimage.com/117x100.png/dddddd/000000
159,Comedy,Accessory nipple,http://dummyimage.com/120x100.png/dddddd/000000
160,Crime|Drama,"Adverse effect of mineralocorticoids and their antag, subs",http://dummyimage.com/206x100.png/5fa2dd/ffffff
161,Drama|Thriller,"Contact with hot water in bath or tub, initial encounter",http://dummyimage.com/171x100.png/dddddd/000000
162,Documentary,"Civilian in water injured by military watercraft, sequela",http://dummyimage.com/122x100.png/ff4444/ffffff
163,Drama|Romance,"Displaced unsp fracture of right lesser toe(s), init",http://dummyimage.com/108x100.png/cc0000/ffffff
164,Musical,"Hyp hrt & chr kdny dis w/o hrt fail, w stg 1-4/unsp chr kdny",http://dummyimage.com/189x100.png/dddddd/000000
165,Comedy,"Toxic effect of oth substances, undetermined, init encntr",http://dummyimage.com/148x100.png/ff4444/ffffff
166,Comedy,Fracture of ulna styloid process,http://dummyimage.com/198x100.png/5fa2dd/ffffff
167,Comedy|Romance,Chalazion,http://dummyimage.com/225x100.png/5fa2dd/ffffff
168,Crime|Drama|Mystery|Thriller,"Displ spiral fx shaft of l fibula, 7thR",http://dummyimage.com/222x100.png/cc0000/ffffff
169,Drama,"Contusion of breast, unspecified breast, subs encntr",http://dummyimage.com/188x100.png/dddddd/000000
170,Documentary,"Progressive external ophthalmoplegia, left eye",http://dummyimage.com/101x100.png/5fa2dd/ffffff
171,Action|Horror,"Unsp injury of brachial artery, right side, init encntr",http://dummyimage.com/111x100.png/5fa2dd/ffffff
172,Comedy,Unsp inj flexor musc/fasc/tend r little finger at forarm lv,http://dummyimage.com/152x100.png/ff4444/ffffff
173,Drama,Immersion hand and foot,http://dummyimage.com/117x100.png/cc0000/ffffff
174,Horror|Sci-Fi,Prsn brd/alit pedl cyc injured in collision w rail trn/veh,http://dummyimage.com/117x100.png/dddddd/000000
175,Animation|Children|Fantasy,"Oth comp specific to multiple gestation, first trimester",http://dummyimage.com/116x100.png/5fa2dd/ffffff
176,Thriller,"Strain of musc/fasc/tend at shldr/up arm, right arm",http://dummyimage.com/117x100.png/dddddd/000000
177,Comedy|Horror|Musical,Other enthesopathies,http://dummyimage.com/145x100.png/dddddd/000000
178,Documentary,"Other cyst of bone, left hand",http://dummyimage.com/104x100.png/dddddd/000000
179,Comedy|Drama,"Displacement of femoral arterial graft (bypass), sequela",http://dummyimage.com/184x100.png/dddddd/000000
180,Drama,"Anaphylactic reaction due to food additives, init encntr",http://dummyimage.com/105x100.png/ff4444/ffffff
181,Documentary,"Disp fx of lateral condyle of r femr, 7thQ",http://dummyimage.com/231x100.png/5fa2dd/ffffff
182,Comedy|Drama,"Malignant neoplasm of uterine adnexa, unspecified",http://dummyimage.com/115x100.png/ff4444/ffffff
183,Comedy|Documentary,"Disp fx of prox phalanx of l less toe(s), 7thK",http://dummyimage.com/200x100.png/5fa2dd/ffffff
184,(no genres listed),"Corros second degree of head, face, and neck, unsp site",http://dummyimage.com/136x100.png/5fa2dd/ffffff
185,Comedy|Drama|Romance,"Nondisp fx of base of 2nd MC bone. l hand, 7thD",http://dummyimage.com/146x100.png/ff4444/ffffff
186,Action|Drama|Thriller,"Insect bite (nonvenomous) of nose, sequela",http://dummyimage.com/184x100.png/ff4444/ffffff
187,Drama|Romance,Sicca syndrome with lung involvement,http://dummyimage.com/154x100.png/dddddd/000000
188,Documentary,Dislocation of MCP joint of left middle finger,http://dummyimage.com/163x100.png/ff4444/ffffff
189,Drama,Open bite of larynx,http://dummyimage.com/103x100.png/5fa2dd/ffffff
190,Comedy,"Oclr lac/rupt w prolaps/loss of intraoc tissue, r eye, subs",http://dummyimage.com/163x100.png/ff4444/ffffff
191,Adventure|Drama|Romance,"Pathological fracture, left toe(s), subs for fx w malunion",http://dummyimage.com/189x100.png/ff4444/ffffff
192,Comedy|Crime|Drama,Postproc hemor of unsp and adnexa following other procedure,http://dummyimage.com/228x100.png/dddddd/000000
193,Crime|Drama,"Unsp injury of msl/tnd of unsp wall of thorax, init",http://dummyimage.com/202x100.png/cc0000/ffffff
194,Action|Drama|Romance,"Terrorism, secondary effects",http://dummyimage.com/142x100.png/ff4444/ffffff
195,Comedy|Drama,Embolism and thrombosis of other arteries,http://dummyimage.com/139x100.png/ff4444/ffffff
196,Drama,"Nondisp fx of nk of 2nd MC bone, l hand, 7thP",http://dummyimage.com/208x100.png/5fa2dd/ffffff
197,Crime|Mystery,"Other malformation of placenta, first trimester",http://dummyimage.com/103x100.png/dddddd/000000
198,Drama|War,Encounter for immunization,http://dummyimage.com/234x100.png/ff4444/ffffff
199,Comedy|Documentary,"Carcinoma in situ of skin of lower limb, including hip",http://dummyimage.com/100x100.png/dddddd/000000
200,Action|Drama,"Oth fracture of T5-T6 vertebra, init for opn fx",http://dummyimage.com/177x100.png/dddddd/000000
201,Comedy|Sci-Fi,"Disp fx of 4th metatarsal bone, r ft, subs for fx w malunion",http://dummyimage.com/103x100.png/cc0000/ffffff
202,Drama|Romance,"Displ artic fx head of r femur, subs for clos fx w nonunion",http://dummyimage.com/245x100.png/cc0000/ffffff
203,Thriller,"Arthritis due to other bacteria, left hand",http://dummyimage.com/238x100.png/ff4444/ffffff
204,Mystery|Thriller,"Fall into natrl body of water strk botm cause oth inj, sqla",http://dummyimage.com/106x100.png/5fa2dd/ffffff
205,Documentary,"Burn first deg mult sites of left lower limb, except ank/ft",http://dummyimage.com/123x100.png/ff4444/ffffff
206,Comedy|Drama,"Diseases of the skin, subcu complicating the puerperium",http://dummyimage.com/120x100.png/dddddd/000000
207,Crime|Documentary,Madarosis of right lower eyelid and periocular area,http://dummyimage.com/121x100.png/ff4444/ffffff
208,Comedy,"Oth disrd of bone density and structure, right ank/ft",http://dummyimage.com/250x100.png/5fa2dd/ffffff
209,Drama,Motorcycle passenger injured in collision w ped/anml nontraf,http://dummyimage.com/112x100.png/cc0000/ffffff
210,Drama|War,Alpers disease,http://dummyimage.com/175x100.png/cc0000/ffffff
211,Horror|Mystery|Thriller,"Oth exposure to uncontrolled fire in bldg, sequela",http://dummyimage.com/110x100.png/ff4444/ffffff
212,(no genres listed),Digestants,http://dummyimage.com/158x100.png/dddddd/000000
213,Adventure|Animation|Fantasy,"Flail joint, right knee",http://dummyimage.com/129x100.png/5fa2dd/ffffff
214,Documentary,Tuberculosis of spine,http://dummyimage.com/180x100.png/cc0000/ffffff
215,Drama,"Displ seg fx shaft of ulna, r arm, 7thP",http://dummyimage.com/177x100.png/dddddd/000000
216,Comedy|Drama,"Electrolytic, caloric and water-balance agents",http://dummyimage.com/133x100.png/cc0000/ffffff
217,Comedy|Romance,Burns of 70-79% of body surfc w 0% to 9% third degree burns,http://dummyimage.com/125x100.png/5fa2dd/ffffff
218,Drama|Sci-Fi,Obstructed labor due to brow presentation,http://dummyimage.com/135x100.png/cc0000/ffffff
219,Comedy,Pressure ulcer of left hip,http://dummyimage.com/145x100.png/5fa2dd/ffffff
220,Drama,"Poisoning by pyrazolone derivatives, undetermined, subs",http://dummyimage.com/136x100.png/5fa2dd/ffffff
221,Drama,"Disp fx of body of hamate bone, l wrs, 7thD",http://dummyimage.com/220x100.png/cc0000/ffffff
222,Comedy|Crime|Mystery|Romance|Thriller,"Osteitis condensans, ankle and foot",http://dummyimage.com/131x100.png/dddddd/000000
