Category_ID,Category_Name,Category_Description,Category_Image
440,Adventure|Sci-Fi,"Unstable burst fx T5-T6 vertebra, subs for fx w nonunion",http://dummyimage.com/238x100.png/cc0000/ffffff
441,Horror|Thriller,"Animl-ridr injured by fall fr animl in nonclsn acc, init",http://dummyimage.com/156x100.png/dddddd/000000
442,Drama|Romance,"Occup of dune buggy injured in nontraffic accident, subs",http://dummyimage.com/173x100.png/ff4444/ffffff
443,Comedy|Horror,Other perinatal hematological disorders,http://dummyimage.com/179x100.png/dddddd/000000
444,Drama,"Displ transverse fx shaft of l ulna, 7thH",http://dummyimage.com/182x100.png/dddddd/000000
445,Drama|Romance,"Poisn by slctv seroton/norepineph reup inhibtr, asslt, sqla",http://dummyimage.com/132x100.png/ff4444/ffffff
446,Action|Adventure,"Unspecified injury of left elbow, subsequent encounter",http://dummyimage.com/172x100.png/ff4444/ffffff
447,Documentary,"Nondisplaced fracture of second metatarsal bone, left foot",http://dummyimage.com/229x100.png/ff4444/ffffff
448,Drama,"Poisoning by tricyclic antidepressants, accidental, sequela",http://dummyimage.com/108x100.png/dddddd/000000
449,Comedy|Romance,"Counseling, unspecified",http://dummyimage.com/199x100.png/cc0000/ffffff
450,Crime|Sci-Fi,"Poisoning by benzodiazepines, assault",http://dummyimage.com/146x100.png/5fa2dd/ffffff
451,Drama|War,"Acute recurrent sinusitis, unspecified",http://dummyimage.com/115x100.png/cc0000/ffffff
452,Drama|Horror,Dual sensory impairment,http://dummyimage.com/139x100.png/cc0000/ffffff
453,Drama,"Other nondisp fx of lower end of unsp humerus, sequela",http://dummyimage.com/195x100.png/dddddd/000000
454,Thriller,"Laceration w/o foreign body of other part of head, sequela",http://dummyimage.com/115x100.png/5fa2dd/ffffff
455,Drama,"Colles' fx left radius, subs for clos fx w delay heal",http://dummyimage.com/108x100.png/ff4444/ffffff
456,Drama|Romance,"Displ commnt fx shaft of r fibula, 7thG",http://dummyimage.com/153x100.png/5fa2dd/ffffff
457,Comedy,"Sprain of left acromioclavicular joint, initial encounter",http://dummyimage.com/134x100.png/dddddd/000000
458,Action|Adventure|Sci-Fi,"Sprain of oth parts of unsp shoulder girdle, subs encntr",http://dummyimage.com/145x100.png/cc0000/ffffff
459,Comedy|Drama|Romance,"Poisoning by androgens and anabolic congeners, assault",http://dummyimage.com/207x100.png/ff4444/ffffff
460,Drama|Romance,"Poisoning by tricyclic antidepressants, self-harm, init",http://dummyimage.com/117x100.png/5fa2dd/ffffff
461,Comedy|Romance,"Corrosion of first degree of left foot, sequela",http://dummyimage.com/192x100.png/5fa2dd/ffffff
462,Documentary,Laceration w foreign body of unsp toe(s) w/o damage to nail,http://dummyimage.com/154x100.png/cc0000/ffffff
463,Drama|Mystery,Changes in retinal vascular appearance,http://dummyimage.com/195x100.png/5fa2dd/ffffff
464,Drama|Romance|Western,Drowning and submersion due to fall off unsp watercraft,http://dummyimage.com/137x100.png/cc0000/ffffff
465,Comedy|Horror,Other GM2 gangliosidosis,http://dummyimage.com/119x100.png/5fa2dd/ffffff
466,Crime|Drama|Mystery,"Chronic periodontitis, generalized, slight",http://dummyimage.com/238x100.png/dddddd/000000
467,Drama|Thriller,"Salpingo-oophoritis in pregnancy, first trimester",http://dummyimage.com/176x100.png/ff4444/ffffff
468,Drama|War,"Disp fx of posterior column of left acetab, init for opn fx",http://dummyimage.com/144x100.png/5fa2dd/ffffff
469,Drama|Sci-Fi,"Type I occipital condyle fracture, left side",http://dummyimage.com/113x100.png/ff4444/ffffff
470,Adventure|Animation,"Other physeal fracture of lower end of unsp tibia, sequela",http://dummyimage.com/145x100.png/5fa2dd/ffffff
471,Comedy|Drama,"Other specified crystal arthropathies, unspecified hip",http://dummyimage.com/124x100.png/dddddd/000000
472,Animation|Children|Comedy,"Traum hemor r cereb w LOC >24 hr w ret consc lev, sequela",http://dummyimage.com/131x100.png/5fa2dd/ffffff
473,Drama|Musical,"Displ pilon fx r tibia, 7thE",http://dummyimage.com/215x100.png/dddddd/000000
474,Horror|Thriller,Disorders of visual cortex in (due to) vascular disorders,http://dummyimage.com/240x100.png/dddddd/000000
475,Comedy,"Gastric contents in larynx causing other injury, init encntr",http://dummyimage.com/187x100.png/5fa2dd/ffffff
476,Adventure|Western,"Maternal care for cervical incompetence, second trimester",http://dummyimage.com/147x100.png/ff4444/ffffff
477,Drama|Horror|War,"Hodgkin lymphoma, unspecified",http://dummyimage.com/239x100.png/5fa2dd/ffffff
478,Documentary|Drama,Displaced pilon fracture of unspecified tibia,http://dummyimage.com/158x100.png/ff4444/ffffff
479,Drama|Thriller,"Neurofibromatosis, type 1",http://dummyimage.com/132x100.png/dddddd/000000
480,Action|Adventure|Drama|War,"Laceration of axillary or brachial vein, left side, init",http://dummyimage.com/212x100.png/5fa2dd/ffffff
481,Drama,Pauciarticular juvenile rheumatoid arthritis,http://dummyimage.com/174x100.png/ff4444/ffffff
482,Drama|Romance,"Other contact with other fish, sequela",http://dummyimage.com/107x100.png/cc0000/ffffff
483,Drama|Romance,"Sltr-haris Type I physl fx upr end r tibia, 7thK",http://dummyimage.com/222x100.png/cc0000/ffffff
484,Comedy|Romance,Osteitis deformans of left forearm,http://dummyimage.com/126x100.png/dddddd/000000
485,Crime|Drama,"Nondisp trimalleol fx unsp low leg, 7thC",http://dummyimage.com/138x100.png/dddddd/000000
486,Crime|Drama|Film-Noir|Thriller,"Rheumatoid bursitis, unspecified shoulder",http://dummyimage.com/246x100.png/dddddd/000000
487,Drama,"Open bite of unsp cheek and temporomandibular area, subs",http://dummyimage.com/227x100.png/dddddd/000000
488,Comedy|Crime|Drama,"Other spondylosis, cervicothoracic region",http://dummyimage.com/246x100.png/5fa2dd/ffffff
489,Mystery,"Postdysenteric arthropathy, right ankle and foot",http://dummyimage.com/154x100.png/ff4444/ffffff
490,Drama|Fantasy|Horror|Romance|Thriller,"Anterior corneal pigmentations, unspecified eye",http://dummyimage.com/106x100.png/dddddd/000000
491,Comedy,"Osteonecrosis due to previous trauma, left shoulder",http://dummyimage.com/136x100.png/dddddd/000000
492,Drama,Crushing injury of right thigh,http://dummyimage.com/230x100.png/cc0000/ffffff
493,Drama,"Prsn brd/alit from bus inj pick-up truck, pk-up/van, sequela",http://dummyimage.com/109x100.png/cc0000/ffffff
494,Comedy|Romance,"Maternal care for hydrops fetalis, unsp trimester, unsp",http://dummyimage.com/197x100.png/dddddd/000000
495,Action|Crime,"Supervision of elderly primigravida, unspecified trimester",http://dummyimage.com/175x100.png/cc0000/ffffff
496,Crime|Drama,"Occup of 3-whl mv inj in clsn w rail trn/veh nontraf, subs",http://dummyimage.com/122x100.png/cc0000/ffffff
497,Crime|Western,"Fracture of coccyx, sequela",http://dummyimage.com/203x100.png/5fa2dd/ffffff
498,Drama,Personal history of in-situ neoplasm of breast,http://dummyimage.com/243x100.png/dddddd/000000
499,Action|Drama|Thriller,"Unsp fx shaft of right femur, subs for clos fx w routn heal",http://dummyimage.com/113x100.png/5fa2dd/ffffff
500,Comedy|Drama,Displacement of artificial skin grft /decellular alloderm,http://dummyimage.com/144x100.png/ff4444/ffffff
501,Horror|Thriller,"Person outside 3-whl mv inj in clsn w pedl cyc nontraf, subs",http://dummyimage.com/171x100.png/ff4444/ffffff
502,Drama|Romance,"Disp fx of shaft of third metacarpal bone, left hand",http://dummyimage.com/151x100.png/ff4444/ffffff
503,Sci-Fi,"Complete traum amp of left shldr/up arm, level unsp, sequela",http://dummyimage.com/129x100.png/cc0000/ffffff
504,Comedy|Romance,"Adhes due to fb acc left in body fol unsp procedure, subs",http://dummyimage.com/177x100.png/5fa2dd/ffffff
505,Comedy,"Unsp car occ inj in clsn with statnry object nontraf, subs",http://dummyimage.com/208x100.png/dddddd/000000
506,Drama,"Corrosion of third degree of unspecified foot, subs encntr",http://dummyimage.com/203x100.png/5fa2dd/ffffff
507,Comedy|Drama,"Toxic effect of unsp substance, accidental, sequela",http://dummyimage.com/241x100.png/ff4444/ffffff
508,Drama|Sci-Fi,"Nondisp fx of medial epicondyl of l humerus, init for opn fx",http://dummyimage.com/204x100.png/dddddd/000000
509,Comedy|Drama,Postproc seroma of left eye and adnexa fol an opth procedure,http://dummyimage.com/133x100.png/5fa2dd/ffffff
510,Horror,"Other specified injuries of right hip, subsequent encounter",http://dummyimage.com/191x100.png/cc0000/ffffff
511,Animation|Children|Comedy,"Oth fx lower end of unsp ulna, init for opn fx type 3A/B/C",http://dummyimage.com/140x100.png/5fa2dd/ffffff
512,Thriller,"Oth physeal fracture of upper end of unsp fibula, init",http://dummyimage.com/131x100.png/cc0000/ffffff
513,Comedy|Thriller,"Mech compl of cranial or spinal infusion catheter, init",http://dummyimage.com/247x100.png/ff4444/ffffff
514,Drama,"Other serum reaction due to vaccination, subs encntr",http://dummyimage.com/190x100.png/5fa2dd/ffffff
515,Drama|Romance|War,"Corrosion of unsp degree of left thumb (nail), subs encntr",http://dummyimage.com/139x100.png/ff4444/ffffff
516,Drama,"Galeazzi's fx left rad, subs for opn fx type I/2 w nonunion",http://dummyimage.com/150x100.png/cc0000/ffffff
517,Thriller,"Contusion of right middle finger w/o damage to nail, init",http://dummyimage.com/144x100.png/ff4444/ffffff
518,Comedy,"Puncture wound w/o foreign body of unsp forearm, subs encntr",http://dummyimage.com/157x100.png/dddddd/000000
519,Drama,"Burn of second degree of left foot, subsequent encounter",http://dummyimage.com/139x100.png/5fa2dd/ffffff
520,Drama,Puncture wound w/o foreign body of finger w/o damage to nail,http://dummyimage.com/217x100.png/dddddd/000000
521,Comedy|Drama,"Chondromalacia, left knee",http://dummyimage.com/131x100.png/dddddd/000000
522,Comedy,"Corneal disorder due to contact lens, right eye",http://dummyimage.com/136x100.png/dddddd/000000
523,Comedy|Musical|Romance,Amyloid pterygium,http://dummyimage.com/146x100.png/dddddd/000000
524,Drama|Musical|Romance,"Poisn by local antifung/infect/inflamm drugs, slf-hrm, init",http://dummyimage.com/129x100.png/cc0000/ffffff
525,Documentary,Segmental fracture of shaft of fibula,http://dummyimage.com/108x100.png/5fa2dd/ffffff
526,Horror|Mystery|Thriller,"Other nondisp fx of third cervical vertebra, sequela",http://dummyimage.com/249x100.png/ff4444/ffffff
527,Action|Thriller,"Unsp superficial injury of other part of head, subs encntr",http://dummyimage.com/104x100.png/ff4444/ffffff
528,Comedy,"Paralytic syndrome, unspecified",http://dummyimage.com/131x100.png/cc0000/ffffff
529,Drama,Subluxation of metatarsophalangeal joint of left great toe,http://dummyimage.com/103x100.png/cc0000/ffffff
530,Drama,Abrasion of front wall of thorax,http://dummyimage.com/130x100.png/ff4444/ffffff
531,Adventure|Mystery|Western,"Person outside car injured in clsn w pedl cyc in traf, init",http://dummyimage.com/235x100.png/5fa2dd/ffffff
532,Documentary,Chloasma of left lower eyelid and periocular area,http://dummyimage.com/120x100.png/ff4444/ffffff
533,Drama,"Poisoning by androgens and anabolic congeners, undetermined",http://dummyimage.com/247x100.png/dddddd/000000
534,Comedy,"Path fx in oth dis, left radius, subs for fx w delay heal",http://dummyimage.com/201x100.png/5fa2dd/ffffff
535,Animation|Children,Leakage of breast prosthesis and implant,http://dummyimage.com/182x100.png/ff4444/ffffff
536,Horror,"Poisoning by benzodiazepines, assault",http://dummyimage.com/108x100.png/cc0000/ffffff
537,Comedy|Drama,"Nondisp comminuted fx unsp patella, init for opn fx type I/2",http://dummyimage.com/171x100.png/5fa2dd/ffffff
538,Documentary,Animal-rider injured in collision with pedestrian or animal,http://dummyimage.com/108x100.png/ff4444/ffffff
539,Comedy|Musical,Family history of tobacco abuse and dependence,http://dummyimage.com/223x100.png/5fa2dd/ffffff
540,Thriller,"Poisn by unsp sys anti-infect and antiparastc, acc, subs",http://dummyimage.com/233x100.png/5fa2dd/ffffff
541,(no genres listed),"Poisoning by oth nonopioid analges/antipyret, NEC, self-harm",http://dummyimage.com/187x100.png/5fa2dd/ffffff
542,Western,Displaced transverse fracture of shaft of unspecified ulna,http://dummyimage.com/183x100.png/5fa2dd/ffffff
543,Drama|Thriller,"Osteonecrosis due to previous trauma, left fibula",http://dummyimage.com/172x100.png/dddddd/000000
544,Drama|Romance,"Disp fx of shaft of right clavicle, init for clos fx",http://dummyimage.com/124x100.png/ff4444/ffffff
545,Action|Adventure|Animation|Horror,Coloboma of iris,http://dummyimage.com/157x100.png/ff4444/ffffff
546,Action|Comedy|Crime,Minor laceration of unsp innominate or subclavian vein,http://dummyimage.com/104x100.png/cc0000/ffffff
547,Action|Drama|Mystery|Romance|Sci-Fi,"Central retinal vein occls, right eye, with macular edema",http://dummyimage.com/201x100.png/5fa2dd/ffffff
548,Drama,Unspecified fracture of navicular bone of right wrist,http://dummyimage.com/188x100.png/dddddd/000000
549,Drama|Musical|Romance,"Spinal stenosis, lumbar region",http://dummyimage.com/106x100.png/5fa2dd/ffffff
550,Drama,"Displ spiral fx shaft of unsp tibia, 7thH",http://dummyimage.com/165x100.png/cc0000/ffffff
551,Comedy,"Oth soft tissue disord related to use/pressure, right ank/ft",http://dummyimage.com/243x100.png/cc0000/ffffff
552,Comedy,"Keratoconus, unstable",http://dummyimage.com/240x100.png/dddddd/000000
553,Drama,"Mantle cell lymphoma, intrapelvic lymph nodes",http://dummyimage.com/147x100.png/ff4444/ffffff
554,Crime|Drama|Horror|Thriller,"Torus fx upper end of r radius, subs for fx w delay heal",http://dummyimage.com/143x100.png/5fa2dd/ffffff
555,Comedy,Oth soft tissue disorders related to use/pressure of ank/ft,http://dummyimage.com/178x100.png/cc0000/ffffff
556,Drama,"Obst due to fb acc left in body following endo exam, subs",http://dummyimage.com/114x100.png/5fa2dd/ffffff
557,Horror,"Disp fx of post wl of unsp acetab, subs for fx w delay heal",http://dummyimage.com/222x100.png/cc0000/ffffff
558,Drama|Thriller,Strain of flexor musc/fasc/tend l little finger at forarm lv,http://dummyimage.com/133x100.png/dddddd/000000
559,Horror|Thriller,"Unsp fx unsp low leg, subs for opn fx type 3A/B/C w malunion",http://dummyimage.com/127x100.png/ff4444/ffffff
560,Drama,"Laceration of muscle and tendon of head, initial encounter",http://dummyimage.com/124x100.png/cc0000/ffffff
561,Comedy|Horror,"Oth incomplete lesion at C7, subs",http://dummyimage.com/157x100.png/dddddd/000000
562,Comedy,"Laceration w fb of left eyelid and periocular area, subs",http://dummyimage.com/101x100.png/cc0000/ffffff
563,Comedy,"Toxic effect of hydrogen sulfide, self-harm, init",http://dummyimage.com/166x100.png/cc0000/ffffff
564,Horror|Thriller,"Toxic effect of tobacco cigarettes, accidental, sequela",http://dummyimage.com/106x100.png/5fa2dd/ffffff
565,Action|Crime|Drama,"Corros third degree of unsp mult fngr, not inc thumb, init",http://dummyimage.com/240x100.png/cc0000/ffffff
566,Mystery,Occupant of anml-drn vehicle injured in unsp trnsp accident,http://dummyimage.com/166x100.png/ff4444/ffffff
567,Drama|Romance,"Pressure ulcer of unspecified hip, stage 3",http://dummyimage.com/123x100.png/ff4444/ffffff
568,Comedy|Horror,"Subluxation of unsp interphaln joint of l mid finger, init",http://dummyimage.com/210x100.png/cc0000/ffffff
569,Comedy|Romance,"Nondisp fx of med condyle of l femr, 7thC",http://dummyimage.com/191x100.png/ff4444/ffffff
570,Drama|Romance,"Unsp fx lower end of l ulna, subs for clos fx w delay heal",http://dummyimage.com/157x100.png/dddddd/000000
571,Comedy|Western,"War op w unsp effect of nuclear weapon, civilian, init",http://dummyimage.com/163x100.png/ff4444/ffffff
572,Drama,"Cont preg aft elctv fetl rdct of 1 fts or more,1st tri, unsp",http://dummyimage.com/145x100.png/ff4444/ffffff
573,Comedy|Drama|Romance,"Corrosion of second degree of right palm, initial encounter",http://dummyimage.com/192x100.png/cc0000/ffffff
574,Comedy|Drama|Romance,"Spinal enthesopathy, lumbosacral region",http://dummyimage.com/176x100.png/dddddd/000000
575,Comedy|Drama|Romance,War operations involving explosion of marine mine,http://dummyimage.com/132x100.png/dddddd/000000
576,Fantasy|Musical|Romance,Corns and callosities,http://dummyimage.com/124x100.png/5fa2dd/ffffff
577,Adventure|Animation|Children|Drama|Fantasy,"Osteonecrosis in diseases classd elswhr, multiple sites",http://dummyimage.com/244x100.png/cc0000/ffffff
578,Action|Comedy|War,"Nondisp fx of intermediate cuneiform of left foot, init",http://dummyimage.com/168x100.png/ff4444/ffffff
579,Comedy|Romance,"Unsp opn wnd r frnt wl of thorax w/o penet thor cavity, sqla",http://dummyimage.com/143x100.png/dddddd/000000
580,Action|Crime|Drama|Thriller,"Lead-induced chronic gout, left wrist, with tophus (tophi)",http://dummyimage.com/169x100.png/5fa2dd/ffffff
581,Fantasy|Romance|Sci-Fi,Cyst of ora serrata,http://dummyimage.com/219x100.png/ff4444/ffffff
582,Action|Drama,"Partial traumatic MCP amputation of left middle finger, init",http://dummyimage.com/140x100.png/dddddd/000000
583,Documentary,"Nondisp fx of med phalanx of l less toe(s), 7thP",http://dummyimage.com/109x100.png/ff4444/ffffff
584,Drama,"Toxic effect of chewing tobacco, undetermined, sequela",http://dummyimage.com/203x100.png/5fa2dd/ffffff
585,Drama,"Oth disorders of kidney and ureter, not elsewhere classified",http://dummyimage.com/130x100.png/ff4444/ffffff
586,Horror|Thriller,"Fall into natrl body of water strk surfc cause oth inj, subs",http://dummyimage.com/144x100.png/5fa2dd/ffffff
587,Comedy|Musical|Romance,"Nondisp fx of neck of unsp MC bone, subs for fx w nonunion",http://dummyimage.com/210x100.png/ff4444/ffffff
588,Comedy,Unsp pedl cyclst injured in collision w rail trn/veh nontraf,http://dummyimage.com/230x100.png/5fa2dd/ffffff
589,Action|Comedy|Crime,Irritant contact dermatitis due to other chemical products,http://dummyimage.com/121x100.png/cc0000/ffffff
590,Drama,"Other sprain of unspecified shoulder joint, subs encntr",http://dummyimage.com/125x100.png/dddddd/000000
591,Comedy|Thriller,Lacerat musc/tend posterior muscle group at lower leg level,http://dummyimage.com/240x100.png/cc0000/ffffff
592,Comedy|Drama,Perf due to fb acc left in body following remov cath/pack,http://dummyimage.com/231x100.png/cc0000/ffffff
593,Comedy|Drama|Fantasy|Romance,"Dislocation of unspecified scapula, initial encounter",http://dummyimage.com/192x100.png/ff4444/ffffff
594,Horror|Thriller,Superficial frostbite of left knee and lower leg,http://dummyimage.com/186x100.png/cc0000/ffffff
595,Documentary|Musical,"Unspecified superficial injury of right knee, subs encntr",http://dummyimage.com/209x100.png/5fa2dd/ffffff
596,Documentary,"Contus/lac cereb, w LOC of unsp duration, subs",http://dummyimage.com/122x100.png/5fa2dd/ffffff
597,Comedy,"Fracture oth prt scapula, left shoulder, init for opn fx",http://dummyimage.com/135x100.png/ff4444/ffffff
598,Comedy|Drama|Romance,Bent bone of unspecified radius,http://dummyimage.com/214x100.png/5fa2dd/ffffff
599,Drama|Mystery|War,"Hypersecretion glaucoma, left eye",http://dummyimage.com/244x100.png/cc0000/ffffff
600,Documentary,Benign neoplasm of right renal pelvis,http://dummyimage.com/172x100.png/cc0000/ffffff
601,Comedy|Fantasy|Thriller,Thromboangiitis obliterans [Buerger's disease],http://dummyimage.com/110x100.png/cc0000/ffffff
602,Comedy|Drama,"Disp fx of lateral malleolus of r fibula, 7thN",http://dummyimage.com/144x100.png/cc0000/ffffff
603,Drama,"Lacerat extn musc/fasc/tend l idx fngr at wrs/hnd lv, sqla",http://dummyimage.com/136x100.png/cc0000/ffffff
604,Comedy|Horror,"Laceration w/o foreign body of unsp part of thorax, subs",http://dummyimage.com/121x100.png/dddddd/000000
605,Documentary,"Underdosing of beta-adrenoreceptor antagonists, sequela",http://dummyimage.com/119x100.png/5fa2dd/ffffff
606,Comedy,Pressure ulcer of heel,http://dummyimage.com/129x100.png/5fa2dd/ffffff
607,Drama,Contusion of left little finger without damage to nail,http://dummyimage.com/209x100.png/cc0000/ffffff
608,Crime|Horror|Mystery,"Nondisp transverse fx shaft of l fibula, 7thB",http://dummyimage.com/215x100.png/dddddd/000000
609,Comedy|Drama|Romance,"Parasitic cyst of retina, unspecified eye",http://dummyimage.com/125x100.png/dddddd/000000
610,Drama|War,"Unsp fracture of T5-T6 vertebra, subs for fx w routn heal",http://dummyimage.com/201x100.png/cc0000/ffffff
611,Comedy,"Unsp pedl cyclst injured in collision w hv veh nontraf, init",http://dummyimage.com/202x100.png/dddddd/000000
612,Drama|Western,"Viral meningitis, unspecified",http://dummyimage.com/227x100.png/5fa2dd/ffffff
613,Drama|Mystery,"Unspecified open wound of vagina and vulva, init encntr",http://dummyimage.com/106x100.png/ff4444/ffffff
614,Sci-Fi,"Nondisp Maisonneuve's fx r leg, subs for clos fx w nonunion",http://dummyimage.com/100x100.png/dddddd/000000
615,Drama,"Unsp mtrcy rider inj pk-up truck, pk-up/van nontraf, sequela",http://dummyimage.com/247x100.png/cc0000/ffffff
616,Horror,"Burn 2nd deg of unsp site right lower limb, ex ank/ft, init",http://dummyimage.com/110x100.png/cc0000/ffffff
617,Drama|Thriller,"Unsp injury of intercostl blood vessels, right side, sequela",http://dummyimage.com/203x100.png/ff4444/ffffff
618,Drama|Romance,"Poisoning by pyrazolone derivatives, accidental",http://dummyimage.com/182x100.png/dddddd/000000
619,Comedy|Drama,"Injury of nerves at wrs/hnd lv of unsp arm, sequela",http://dummyimage.com/245x100.png/cc0000/ffffff
620,Drama,Left sided colitis with rectal bleeding,http://dummyimage.com/160x100.png/cc0000/ffffff
621,Action|Adventure|Drama|War|Western,Atrophic flaccid tympanic membrane,http://dummyimage.com/119x100.png/dddddd/000000
622,Drama|Musical,"Mech compl of other urinary devices and implants, sequela",http://dummyimage.com/196x100.png/cc0000/ffffff
623,Drama,"Unsp injury of ulnar artery at wrs/hnd lv of right arm, subs",http://dummyimage.com/155x100.png/5fa2dd/ffffff
624,Fantasy|Horror|Thriller,Birth injury to skeleton,http://dummyimage.com/122x100.png/dddddd/000000
625,Drama,"Pnctr w/o fb of unsp eyelid and periocular area, subs",http://dummyimage.com/228x100.png/dddddd/000000
626,Drama,"Traum hemor left cerebrum w LOC of 6 hours to 24 hours, subs",http://dummyimage.com/121x100.png/cc0000/ffffff
627,Comedy|Drama,"Sltr-haris Type III physl fx lower end of unsp femur, sqla",http://dummyimage.com/163x100.png/ff4444/ffffff
628,Horror|Sci-Fi|Thriller,"Intentional self-harm by other specified means, subs encntr",http://dummyimage.com/117x100.png/dddddd/000000
629,Action|Comedy|Crime,"Primary blast injury of ear, bilateral, subsequent encounter",http://dummyimage.com/244x100.png/dddddd/000000
630,Drama|Romance,Mechanical lagophthalmos right lower eyelid,http://dummyimage.com/190x100.png/dddddd/000000
631,Drama,"Legal intervnt w oth blunt objects, bystand injured, subs",http://dummyimage.com/152x100.png/ff4444/ffffff
632,Documentary|Drama|War,"Encephalocele, unspecified",http://dummyimage.com/152x100.png/ff4444/ffffff
633,Crime|Drama,"Sltr-haris Type III physl fx lower end humer, left arm, 7thG",http://dummyimage.com/187x100.png/cc0000/ffffff
634,Drama,"Unspecified injury of unspecified renal artery, init encntr",http://dummyimage.com/111x100.png/ff4444/ffffff
635,Action|Adventure|Sci-Fi,"Disloc of distal radioulnar joint of right wrist, sequela",http://dummyimage.com/181x100.png/5fa2dd/ffffff
636,Comedy,"Malignant neoplasm of lower-inner quadrant of breast, male",http://dummyimage.com/174x100.png/cc0000/ffffff
637,Drama,Blister (nonthermal) of right eyelid and periocular area,http://dummyimage.com/105x100.png/cc0000/ffffff
638,Western,"Complete oblique atypical femoral fracture, left leg, 7thK",http://dummyimage.com/180x100.png/ff4444/ffffff
639,Drama|Mystery,"Nondisp fx of 4th metatarsal bone, unsp ft, init for opn fx",http://dummyimage.com/231x100.png/5fa2dd/ffffff
640,Action|Adventure|Animation|Drama|Sci-Fi,Drug/chem diabetes w prolif diabetic rtnop w macular edema,http://dummyimage.com/167x100.png/5fa2dd/ffffff
641,Action|Crime|Thriller,"Sprain of other part of left wrist and hand, sequela",http://dummyimage.com/157x100.png/dddddd/000000
642,Documentary,Open bite of forearm,http://dummyimage.com/105x100.png/ff4444/ffffff
643,Drama,Recur and perst hematur w diffus mesangial prolif glomrlneph,http://dummyimage.com/144x100.png/5fa2dd/ffffff
644,Action|Horror|Sci-Fi|Thriller,"Unsp fracture of lower end of right femur, init for clos fx",http://dummyimage.com/228x100.png/dddddd/000000
645,Crime|Drama|Romance,"Inhalation of steam and other hot vapors, subs encntr",http://dummyimage.com/156x100.png/5fa2dd/ffffff
646,Drama,"Other disorders of continuity of bone, right fibula",http://dummyimage.com/140x100.png/ff4444/ffffff
647,Documentary,"Nondisp bicondylar fx unsp tibia, 7thF",http://dummyimage.com/221x100.png/dddddd/000000
648,Documentary,Mechanical ectropion of eyelid,http://dummyimage.com/207x100.png/cc0000/ffffff
649,Action,"Other rupture of muscle (nontraumatic), right forearm",http://dummyimage.com/150x100.png/ff4444/ffffff
650,Comedy|Crime,"Nondisp fx of proximal phalanx of l little finger, sequela",http://dummyimage.com/203x100.png/ff4444/ffffff
651,Drama|Romance,"Ped w convey injured in collision w 2/3-whl mv, unsp, subs",http://dummyimage.com/133x100.png/cc0000/ffffff
652,Crime|Drama,Unspecified injury of inferior vena cava,http://dummyimage.com/205x100.png/5fa2dd/ffffff
653,Comedy|Romance,"Subluxation of unsp interphaln joint of unsp finger, sequela",http://dummyimage.com/163x100.png/5fa2dd/ffffff
654,Comedy|Romance,"Unsp injury of intercostal blood vessels, unsp side, sequela",http://dummyimage.com/146x100.png/5fa2dd/ffffff
655,Drama|Romance,"Nondisp fx of prox phalanx of unsp fngr, 7thD",http://dummyimage.com/217x100.png/dddddd/000000
656,Action|Drama|War,Autologous blood donor,http://dummyimage.com/116x100.png/cc0000/ffffff
657,Action|Crime,"Villonodular synovitis (pigmented), left hand",http://dummyimage.com/101x100.png/dddddd/000000
658,Comedy|Romance,Atresia of esophagus without fistula,http://dummyimage.com/165x100.png/cc0000/ffffff
